{
  "version": "1.0.0",
  "stack": {
    "count": 3,
    "vertical_offsets": [0, 8, 16],
    "opacity_tiers": [0.55, 0.45, 0.35],
    "scale_tiers": [1.0, 0.95, 0.9]
  },
  "breathing": {
    "amplitude": 0.08,
    "frequency": 2.734
  },
  "recoil": {
    "shear_intensity": 1.2,
    "duration_ms": 150,
    "z_promotion": 2
  },
  "dissolve": {
    "duration_ms": 400,
    "noise_frequency": 4.0
  },
  "trail": {
    "count": 6,
    "lifetime_ms": 300,
    "intensity": 0.2
  },
  "colors": {
    "spectral_tint": "#2A6F6F",
    "inner_bleed": "#9A8C98",
    "after_image": "#C9ADA7"
  }
}
